Prinzipien des Datenschutzes	• Zweckbindung: Bindung an eindeutige und legitime Zwecke / • Datensparsamkeit: Dem Zweck angemessen und beschränkt / • Speicherbegrenzung: Daten werden nur so lange wie nötig gespeichert
Definition Pseudonymisierung	Daten können nicht ohne weitere Informationen zum Patienten zugeordnet werden / Diese weiteren Informationen müssen gesondert aufbewahrt werden
Definition Anonymisierung	Informationen können nicht mehr einer Person zugeordnet werden
Maßnahmen zum Datenschutz nach BDSG §64	• Zugangskontrolle / • Datenträgerkontrolle / • Übertragungskontrolle / • Benutzerkontrolle (Accounts) / • Eingabekontrolle
Konkrete Datenschutzmaßnahmen	• Kryptographie / • Funktionstrennung / • Berechtigungskonzept / • Wiederherstellbarkeit / • Benutzeraccounts
Voraussetzungen Datenverarbeitung in der Forschung	• Einwilligung / • Zugriffsregelung / • Pseudonymisierung / • Kommittee / • Datenschutzbeauftragte
